{
  "$schema": "https://json-schema.org/draft/2020-12/schema",
  "$id": "https://github.com/pytincture/pytincture/contracts/release-qualification-v1.schema.json",
  "title": "Pytincture 1.0 release qualification",
  "type": "object",
  "required": [
    "schema_version",
    "minimum_observation_days",
    "observation_started_at",
    "observation_approval_url",
    "release_candidates",
    "representative_applications",
    "upgrade_exercises",
    "rollback_exercises",
    "performance_reviews",
    "repository_policy_reviews",
    "production_edge_reviews",
    "security_reviews",
    "defect_audits",
    "final_decision"
  ],
  "properties": {
    "schema_version": {
      "const": 1
    },
    "minimum_observation_days": {
      "type": "integer",
      "minimum": 30
    },
    "observation_started_at": {
      "type": "string",
      "format": "date-time"
    },
    "observation_approval_url": {
      "type": "string",
      "format": "uri"
    },
    "release_candidates": {
      "type": "array"
    },
    "representative_applications": {
      "type": "object",
      "required": [
        "standalone",
        "authenticated_bff",
        "federated_auth"
      ]
    },
    "upgrade_exercises": {
      "type": "array"
    },
    "rollback_exercises": {
      "type": "array"
    },
    "performance_reviews": {
      "type": "array"
    },
    "repository_policy_reviews": {
      "type": "array"
    },
    "production_edge_reviews": {
      "type": "array"
    },
    "security_reviews": {
      "type": "array"
    },
    "defect_audits": {
      "type": "array"
    },
    "final_decision": {
      "type": "object",
      "required": [
        "status",
        "decided_at",
        "approvers",
        "notes"
      ],
      "properties": {
        "status": {
          "enum": [
            "pending",
            "go",
            "no-go"
          ]
        }
      }
    },
    "release_exceptions": {
      "type": "array",
      "items": {
        "type": "object",
        "required": [
          "scope",
          "release_version",
          "candidate_version",
          "approved_by",
          "approved_at",
          "reason",
          "approval_source"
        ],
        "properties": {
          "scope": {
            "enum": [
              "production_edge_reviews",
              "repository_policy_reviews"
            ]
          },
          "release_version": {
            "const": "1.0.0"
          },
          "candidate_version": {
            "type": "string"
          },
          "approved_by": {
            "type": "string",
            "minLength": 1
          },
          "approved_at": {
            "type": "string",
            "format": "date-time"
          },
          "reason": {
            "type": "string",
            "minLength": 1
          },
          "approval_source": {
            "type": "string",
            "minLength": 1
          }
        },
        "additionalProperties": false
      }
    }
  }
}
