{
  "$schema": "../contracts/release-qualification-v1.schema.json",
  "schema_version": 1,
  "minimum_observation_days": 30,
  "observation_started_at": "2026-08-29T02:08:06Z",
  "observation_approval_url": "https://github.com/pytincture/pytincture/issues/143#issuecomment-5459957268",
  "release_candidates": [
    {
      "version": "1.0.0rc1",
      "published_at": "2026-08-28T20:09:58Z",
      "commit_sha": "e4feb231ab674e85c2e162fb935b6e2e45da5f8a",
      "ci_url": "https://github.com/pytincture/pytincture/actions/runs/33206734049",
      "artifacts": {
        "wheel": "aa5e11139f14bf8317bdb77d57c49cd55311533370414506fed79b1a6fc9e64b",
        "sdist": "d3546a1109efdee1d61fac15d3a8e7252d3c111d8158c060fd5cac6343187bbb",
        "npm": "085f5fb67a4b6e4878321579159e66e03892d6a7f60740c8421cb61cb3a7b587"
      },
      "status": "passed",
      "notes": "Signed GitHub prerelease and PyPI artifacts are published. The matching retained npm tarball is integrity-checked; npm registry publication is deferred and does not block the approved observation track."
    },
    {
      "version": "1.0.0rc2",
      "published_at": "2026-08-30T02:28:58Z",
      "commit_sha": "9757ce29fe13863118177a244efefc88aa5b194a",
      "ci_url": "https://github.com/pytincture/pytincture/actions/runs/33288079592",
      "artifacts": {
        "wheel": "9fab32bc689a372099f3c0a8d8b72a9290168a6dd5cf35adb47fb7d75986d70e",
        "sdist": "25f83c803d08ed192f82cf77039e7fc7a96d2af0df0a58fb6afd97537e19de6c",
        "npm": "a04cf74e0e4f8373c1f132ed0f0f9a1e3e3916acd377dfbc617f89b18aa36149"
      },
      "status": "passed",
      "notes": "Signed GitHub prerelease, attested wheel/source distribution, and PyPI 1.0.0rc2 are published. The matching retained npm tarball is attested; npm registry approval remains a deferred distribution task."
    },
    {
      "version": "1.0.0rc3",
      "published_at": "2026-09-01T02:36:23Z",
      "commit_sha": "6b49958c7e9cc11547db15d3d0c47feb4baad1a8",
      "ci_url": "https://github.com/pytincture/pytincture/actions/runs/33463168037",
      "artifacts": {
        "wheel": "e5aaa4efb9e64573180967a75fba785b0c7fab15c2d45b2eddcbdbc5482a1de3",
        "sdist": "b745583bd5f61a1125e85b11db5097f8f5c3034534d1cbb3594ebdab22fa1b27",
        "npm": "47fcb8ddf64fea2bd590dbd313e3d36017ea3299931b18903d9c62536bfdd95f"
      },
      "status": "passed",
      "notes": "The signed GitHub prerelease is published; the exact wheel, source distribution, and npm tarball are retained and attested. The protected PyPI and npm OIDC publishers verified those artifacts and are waiting for non-self environment approval; registry publication is a distribution task and does not invalidate candidate qualification."
    },
    {
      "version": "1.0.0rc4",
      "published_at": "2026-09-01T20:23:24Z",
      "commit_sha": "ec1d7b8aa33b0a551f3e48311daebe91c8ca17c5",
      "ci_url": "https://github.com/pytincture/pytincture/actions/runs/33555029444",
      "artifacts": {
        "wheel": "cab434e127bdd0fe9c40826e1cace82d136f5e0f8b31e3439f507f4900e6427b",
        "sdist": "141a78e0f127f7781a2624fff7ec9cb3e806cf5b87027241eab48be79e8c5c34",
        "npm": "e2acda3a62eb56009130b47191fdcf8a96dab852fc4cb07ce6f95e0242b9f8d6"
      },
      "status": "passed",
      "notes": "The signed GitHub prerelease is published; the exact wheel, source distribution, and npm tarball are retained, reproducible, and attested. PyPI 1.0.0rc4 was published through the protected project-token workflow; npm registry publication remains a separate distribution task. Rc4 qualifies all 2026-09-01 review remediations without changing the approved stateless, Redis-free observation scope."
    },
    {
      "version": "1.0.0rc5",
      "published_at": "2026-09-03T13:02:35Z",
      "commit_sha": "9463366620afe275c6604dd000a76bf41afe7514",
      "ci_url": "https://github.com/pytincture/pytincture/actions/runs/33758760808",
      "artifacts": {
        "wheel": "37652d89ee7906dd447bfd78f1ee6b25e514a13d598f4739f4d706039af4b0c1",
        "sdist": "faab819a6447c4a58b4b086234776fc17704a69712c2181afda50b07b41ccbf0",
        "npm": "ef73523b6e0fd84b1fd35350ba5f50a2597dad5691bcc79cea3b5596a2c89f2a"
      },
      "status": "passed",
      "notes": "The signed GitHub prerelease, exact retained and attested artifacts, complete acceptance matrix, and protected PyPI API-token publication all passed. The exact public wheel installs as 1.0.0rc5. The retained npm tarball remains the qualified npm artifact; npm registry publication is a separate distribution task. Rc5 qualifies the follow-up and capacity hardening while preserving the approved stateless, Redis-free observation scope."
    },
    {
      "version": "1.0.0rc6",
      "published_at": "2026-09-03T15:59:59Z",
      "commit_sha": "8db4ad2c9380979519646bff171b53e579fa8371",
      "ci_url": "https://github.com/pytincture/pytincture/actions/runs/33775966072",
      "artifacts": {
        "wheel": "fd2a5e922fa9c1d1e3df8b287cfab4a1384b9d190f9ed029ca77caeb51fee287",
        "sdist": "284c0bca61a2468eb06d1e160262b47aea5a788a4cab34466c1bfac8f9bd8140",
        "npm": "3f134ef03208b6be3c5c6d4354b6903a19fd3cfa921a00c8d81186dc71c055cb"
      },
      "status": "passed",
      "notes": "The signed GitHub prerelease, exact retained and attested artifacts, complete acceptance matrix, and protected PyPI API-token publication all passed. The exact public wheel installs as 1.0.0rc6. The retained npm tarball remains the qualified npm artifact; npm registry publication is a separate distribution task. Rc6 completes the self-hosted Material Design Icons CSS, source-map, and font asset chain without restoring a third-party CDN dependency."
    },
    {
      "version": "1.0.0rc7",
      "published_at": "2026-09-18T01:20:35Z",
      "commit_sha": "03b945c8d2a43101bdb6e06b7db25516e3db9550",
      "ci_url": "https://github.com/pytincture/pytincture/actions/runs/35294928734",
      "artifacts": {
        "wheel": "e217def0e65f34d0b59a3b914c432f235a70605996155dedce9d406a05cc4c7a",
        "sdist": "205eddb165c6b559c05d7c21fc844b87e1b60d94a4b359b203ae157f4eacc227",
        "npm": "0a115d74af51c396bf12ea925cf780ba5a92edc1fbe9afc5116fc35686e50b50"
      },
      "status": "passed",
      "notes": "Signed tag qualification and all 23 release CI jobs passed. Exact workflow artifacts and hashes are attached to the GitHub prerelease with verified attestations. Protected PyPI publication succeeded in run 35295139251; both public artifact hashes match and a clean public-index install reports 1.0.0rc7. The npm tarball is retained; npm registry publication is separate. The Book Library example draft has unresolved remote browser/load acceptance findings, and observation-scope review for the optional application-credential registry remains pending."
    },
    {
      "version": "1.0.0rc8",
      "published_at": "2026-09-20T12:28:04Z",
      "commit_sha": "bb59bd2b73fc356c13a2ed4ae36bb06acc66f047",
      "ci_url": "https://github.com/pytincture/pytincture/actions/runs/35510694984",
      "artifacts": {
        "wheel": "3ae409e08c456f65e02555552d0e5ff5b1d29aa2d554f27aacc184eeae2032db",
        "sdist": "d2e3d59cd4358bb57318c0734fec96e66851fa5276ecc220432c0321f2968bb6",
        "npm": "33c77bfcb4e77976951d76d32689abafd67cc753b8848c42ee9eb51dda179428"
      },
      "status": "passed",
      "notes": "Signed tag qualification (35510250996), complete release CI and attestations (35510694984), and protected PyPI publication (35511220297) passed. The exact wheel, source distribution, npm tarball and SHA256SUMS.json are attached to the GitHub prerelease. Public PyPI wheel and sdist bytes match the attested hashes; a fresh Python 3.13 public-index installation imports pytincture and reports 1.0.0rc8. Full pinned Book Library and Wawesome Chat conformance passed for legacy Pyodide, portable Pyodide and portable MicroPython, including voice. npm publisher 35511220284 is waiting for its required independent environment approval; the attested npm artifact remains retained. Companion widget/app changes are conformance patches, not separately published releases. Final 1.0 observation and production-edge approval remain pending."
    },
    {
      "version": "1.0.0rc9",
      "published_at": "2026-09-21T14:24:47Z",
      "commit_sha": "81c76748bac7f9d03708111138fac081851581d6",
      "ci_url": "https://github.com/pytincture/pytincture/actions/runs/35611986858",
      "artifacts": {
        "wheel": "b8f9ac0c0eb5c0949454b58b879248e21f9ef5ecaaf0373eaf2c583346afe7a0",
        "sdist": "e6fd6b5b267fe1ca86b1d4807f7d247bc70386efa99ce895354e03013a7e15ab",
        "npm": "71b4156d044dd02f39e56351b6ca1b05bd4acd88dd929454ace8c913db18a7ba"
      },
      "status": "passed",
      "notes": "Release PR #362, signed-tag qualification (35610728524), all 25 release CI/attestation jobs (35611986858), and protected PyPI publication (35613132108) passed. The wheel, source distribution, npm tarball and SHA256SUMS.json are attached to the GitHub prerelease. Public PyPI wheel/sdist bytes match the attested hashes; a fresh isolated Python 3.13 public-index installation imports version 1.0.0rc9. Full pinned example/chat conformance passed across legacy Pyodide, portable Pyodide and MicroPython. Shared browser fixtures verify nested f-string parity; the unavailable private Tenzyn app is not claimed as validated. npm publisher 35613131751 awaits environment approval. Portable delivery remains opt-in; profile-2 UUID behavior and matching-runtime bundle rebuild requirements are documented. Final 1.0 approvals and observation dates are unchanged."
    },
    {
      "version": "1.0.0rc10",
      "published_at": "2026-09-21T17:13:06Z",
      "commit_sha": "1ceaeac5534804f30c9e3ed47422adebd4ba2e69",
      "ci_url": "https://github.com/pytincture/pytincture/actions/runs/35630591454",
      "artifacts": {
        "wheel": "61cef0b9518a0d36157aeda38dfa87ae777ca65f5fe49aab778c130eb9596d7a",